{
    "type": "dotnet",
    "version": 2,
    "namespace": "Digitall.Dataverse.Model",
    "language": null,
    "entities": {
        "names": [
            "account",
            "contact"
        ],
        "fromSolutions": [
            "dgt_entities"
        ],
        "mask": "dgt_*"
    },
    "requests": [],
    "optionSets": [],
    "output": {
        "target": "Modern",
        "virtual": false,
        "editableReadOnly": false,
        "include": {
            "context": true,
            "options": true,
            "logicalNames": true,
            "relations": true,
            "navigationProps": true,
            "entityTypeCode": true,
            "alternateKeys": true,
            "metadata": false
        }
    }
}
